,review_id,app_id,review_text,label
0,138270888,1494420,"Unplayable in current state due to stutters and perf issues

First time in my life leaving an 'unplayable' review but this time it's the honest true, not just a complaint about 'bad performance'.  Running an RTX 3060 with a 5800x CPU, maxed out everything and every 1 second this game will stutter for 1-2 seconds.  

Have updated video drivers, tried on windowed, fullscreen and fullscreen exclusive
Have tried on all quality settings.
Nothing absnormal in cpu/gpu usage, just terrible stuttering from the movement I land on the ground",0
0,138271406,2311190,i mean i had a better time playing this than GoB 2,0
0,138271245,2311190,THIS IS GOOD I LIKE,1
0,138271218,2311190,"best experience with a 5 dollar deposit.

100% and refund LETS GOOOOOOOOOOOOOO",1
0,138271746,1742020,"This game is fun. It's super fun. Even if you know nothing about the source material, its a fun 2d fighter. You don't need to know too much about the genre before playing it and having a good time. Absolutely recommend",1
0,138271806,2400880,sooo scary almost died :(,1
0,138273073,1940340,Its good.,1
0,138272777,1940340,good game but learning curve is high,1
0,138272610,1940340,40$ for temple run? are you kidding me? NO.,0
0,138272461,1940340,Constant Bonnie Meltdown and Occultist 0 heal and bleed. Love it,1
0,138272359,1940340,"When I saw DD2, I was pretty ecstatic! Loved the first game and had coincidentally just started playing it again. This game is absolutely different from the first. 

First off, level design has changed dramatically. Rather than have a blank map in a dungeon where you move one tile at a time, now you steer a coach with a chance to spot what will occur in front of you. That may be a fight, an encounter with normal people for supplies, debuffs, etc. Furthermore, these paths lead to different ""rooms"" such as a supply runner to buy things, healers, more fights, etc. I personally preferred the map and dungeon system from the first game. Not a knock on this, I just think that feels more like a dungeon crawler where as this seems more like I'm choosing my own adventure type deal and waiting to go from room to room. 

Second, leveling is much different. There are no permanent unlocks for leveling armor, weapons and skills. Each ""expedition"" you choose your party and have limited points (spread throughout the expedition) to upgrade the skills of your party at the inns before and after each part of the mission. You also cannot change your comp or movesets mid expedition, so I find this one is even more trail and error than the first game. Some like that, some don't, just be aware of it. 

Third, unlocks are... interesting. I can't tell if I like it or not. Now you are choosing what heroes you unlock, as well as leveling them through ""memories"" that you can come across on your expeditions. You also can unlock new items to be found and new classes with a currency called ""candles of hope"" that you will find and earn throughout each expedition. This will in turn unlock different classes of the heroes. For instance, the man at arms has a class called ""Sergeant"", where he does less damage but has a chance to give better buffs and can take more hits. I don't know how many classes each hero has but its an interesting way of adding depth.

Fourth, there are now relationships between the characters that you have to attempt to build in order to make your squad function as efficiently as possible. Good relationships will yield extra vbuffs on certain moves, as well as the occasional extra attack. Negative relationships will lead to debuffs on important moves that hamper your ability to engage in combat. It could use some tweaking to make it easier to understand why or when a relationship changes, but ultimately I think its a fun exercise making sure your squad actually likes each other. 

I find myself torn on this game, especially as a sequel. On one hand, I enjoy the game for its art style, combat, and strategy (at least in the little I've played). It has a different type of charm when compared to DD1. However, I can't shake the feeling that if this wasn't marketed as a sequal and was a standalone, I probably wouldn't have bought it. There is a lot changed from the first one and I'm not sure its all for better or worse. This almost feels like comparing apples to oranges in how different these two games feel and play. 

Ultimately, if you enjoyed DD1, I think you will enjoy this. It takes getting used to for sure, but once you acknowledge you cannot play it exactly the same and start to explore it as a new game, I think there is a good amount to like. I think there is definitely some more tweaking to do and if you aren't sold on the game play changes you won't enjoy this. I still find DD1 to be the better game, but if you're looking for a similar experience, this is definitely one game you should check out.",1
0,138272301,1940340,gam gud,1
0,138272265,1940340,"Please don't listen to the negative reviews. Those people wanted a remake of the original not something new. This game is very different, and I actually like it more than the first one. There was a lot of difficult bullshit in the first game that was completely unfair and rng dependent. A lot of the time, I didn't feel the first game cared about the progress you made because once your units are dead. Everything you worked toward is gone. This one leans more towards the roguelike genre, where you loop and start from the beginning each run. There is a nice progression system that actually gives a fuck about your time, even if you fail a run. Despite the massive difficulty, It's still very possible to complete your first run with good strategy. The affinity system is the only thing that is really bothering me at the moment, but it's just one of the many things you'll have to deal with in this punishing game. Highly recommend. Great sequel not a remake.",1
0,138272202,1940340,"Its almost there, but just  misses.  It a dang rogue lite....
They took a great game where you explored different zones, had characters you built on.  Now its a wagon ride with characters that reset every time.  You can unlock some abilities if you play some crappy mini games that do not tell you what to do.
The heroes are not balanced, get ready to die a lot.  Its supposed to be hard...but it takes it about 2 steps beyond that and makes is exasperating and frustrating.
A little easier, some more quest direction/flavor and you got something.

Where is Cuthbert?",0
0,138271295,1940340,"I'll keep this simple: [b]If you think of this as a sequel to Darkest Dungeon in anything other than spirit and lore, you probably won't like it.[/b]

[b]The Good:[/b]
[list]
    [*]With that said, as a roguelite this game is very fun.
    [*]It's atmospheric, difficult, and satisfying.
    [*]The mechanics are easy to grasp because they're fairly intuitive and there are tutorials for everything.
[/list]

[b]The Bad:[/b]
[list]
    [*]I've only experienced one bug which resulted in a softlock for some reason. The Leper's Purge skill had the Target Team: Clear Corpse replaced with Target Team: Instant Kill. I was extremely surprised because it all seemed legit, but then an enemy just kept buffing itself over and over for 3 minutes with no turn rotation. When I relogged it happened again, so I abandoned. I went to pick Leper again then realized the skill wasn't actually supposed to be a full team insta-kill lmao.
    [*]At first it felt very grindy because you have to unlock every hero beyond the starting four. However, after getting decently far or after a couple of runs you can easily unlock every hero so this is essentially a non-issue.
    [*]I think the trinkets could use some refining or reworking. I find myself more often than not simply discarding the vast majority of them instead of accepting the benefits along with the drawbacks. Maybe that's a me thing, but it's worth mentioning.
    [*] Unlocking hero skills is painfully slow. That's really all there is to it. I think learning about heroes backstories is awesome, but there has to be a better way to do it, I'm sorry.
[/list]

Now that I'm writing this I'm realizing the game feels a little unrefined, and this review doesn't really favor it.
[b]I promise it's fun tho lol[/b]

Edit: I think I just really like the whole Darkest Dungeon world and lore lol. Take this extremely biased review with a grain of salt.",1
0,138271261,1940340,"Yes, it isn't Darkest Dungeon 1. That doesn't mean it's bad! Honestly, the focus on more narrative elements, the removal of the default miss chance, and many other great changes have by far made me enjoy this installment more than the first. Highly reccomend.",1
0,138271502,2392060,"Got a good laugh out of me, worth the prices.",1
0,138272192,1730250,"Clocked this after 13 hours, I feel like ""the square hole"" girl meme.",1
0,138271697,1547670,"This game has alot of potential. It is really fun to play with friends however, I feel they need to expand on the other 3 maps. I will gladly play again on full release.",1
0,138273065,1159690,"I make train , i make train in void it good",1
0,138271755,1159690,yes,1
0,138271546,1159690,Relaxing,1
0,138271539,1159690,Awesome game but grindy. Def recommend playing with at least 1 friend. 9/10,1
0,138271481,1159690,Running into bugs that are causing me to need to wait till they are fixed to continue the game.  Like building the steam engine for the train.,0
0,138271206,1159690,the game is fun,1
0,138272561,1230170,"The concept is wonderfully promising, but right now there is too many things with the game that are just irritating the heck out of me.

The game is mostly very linear as it's presented right now. There is no failure point, no branching points where the player can get creative in how to fix the gun. You got a broken part? Maybe you could fix it and restore it, swap it out with a new one or even ignore it completely, at the cost of reputation/money because you forgot about it. You need to have business related features to make it interesting, and maybe you can specialize and/or attract a certain demographic of clients, and compete with others, etc.. 

A good example is that in PC building simulator 2, you can make refurbished/pre-made computers with either used or new parts on top of the usual repair or spec jobs. Some players just make a bunch of cheap, affordable computers that sells easy or super high-end ones with greater profit margins.

There is none of that. The game is simply too straightforward to be interesting in the long run. The whole thing about gunsmithing is you have to get creative when trying to solve specific issues with a gun or maybe reach a certain point of performance (Like accuracy). Maybe you get a gun that has a lot of issues extracting and the client complains about it, and it's up to you to figure out what's wrong. Or maybe some dude wants to be able to shoot at 800 yards accurately, and you need to come up with a gun within a set budget and accessories that can be up to it.

Basically, you can't get creative at all. Get told X, Y and Z. Do X, Y and Z. Congrats, you've beaten the game. 

The gun disassembly process is a big one. Right now, the diassembly requirements, where you NEED to disassemble specific parts that has nothing to do with the job. Best example of this is the Mossberg 590A1 job, which basically only require to swap the synthetic forearm and stock with wood ones. So pretty much all i need to do is remove the forearm and stock, swap them out and done.

However, you absolutely need to remove and detail strip the entire trigger assembly and the front sight (?!?) for some reason, which has nothing to do with the job.

Then the woodworking part is janky and mostly useless. First of all, why do i need to woodwork a forearm and stock for a M590? It's an extremely popular weapon platform and you already find plenty of aftermarket or OEM wood stocks and forearms. The woodworking entirely skip crucial steps like hollowing out the forearm, it just magically go from being a solid piece of wood into a proper hollow forearm when you go to apply some wood finish.

Then there's all kind of little things like not actually ever cleaning the inside of barrels (You just swab the exterior of it with a rag and boom, clean barrel), somehow having to oil every little part you add to the gun (Why do i need to oil a fucking aluminium AK rail? Or stocks and pistol grips?)

So yeah. Concept is definitely promising and could really be interesting and fun if there is simply much more freedom to things.",0
0,138271780,2001340,"Game is good, I like the vengeance route it wants to pursue more than how the story was handled in 1. Game feels less easy to break in two but that's not a bad thing. There's A LOT of new fun stuff to mess with while still being extremely close to 1. Its a case of I just wanted more of 1 and I got it and its a nice cozy time. 

Also, Mei is VERY cute and good.",1
0,138271934,1972050,i luv band camp thank you,1
0,138271584,2379620,idk the game wouldn't run. would just freeze the moment the first level started to load. i have a great pc dont have issues with any games till this one.,0
0,138273008,669330,oddly addicting. Like an RTS without the micro,1
0,138273088,2369390,"Literally just play Just Cause 3. As I was playing Far Cry 6, I craved JC3 because it pretty much has the same story and gameplay but better...

I'd give it a 6/10 (only buy it on sale)",0
0,138272938,2369390,"I have an RTX 3080 with 32gb ram and 8gb vram and this game runs into an issue limiting fps to ~ 10 after about 30 minutes of gameplay or when I tab out of the game. Tried all graphics settings and limiting to 60fps + window mode and the game still runs into the same issue. I can see that this is a common issue for a lot of other players as well.

While trying to resolve the issue it was extremely annoying because even the settings menu was at 10fps and the menu cannot be used with keyboard key which is poor for accessibility and made the troubleshooting experience 10x worse.",0
0,138272808,2369390,not worth a thumbsup even with 70% off,0
0,138272699,2369390,"I never played any Far Cry (R)(TM) game before.

It's OK.",1
0,138272564,2369390,lit asl,1
0,138272081,2369390,Better then call of duty!!,1
0,138271368,2369390,"This game plays worse than Farcry 5, has a lame superficial story, and just generally annoying to play... also buggy in ways AAA games shouldn't be.",0
0,138273178,1924170,"By far the best out of the 3 games, bugs on pc seem minimal, some controller setup issues, odd bugs when in the game have included not being able to change gears, missing rider. However despite these small issues the physics setup on the bikes is immense as you unlock the bike and play with the settings and get use to the handling the game blossoms and becomes exactly what you want, a healthy dose of good physically based feedback from the bike and moments of mind blowing speed that make you want to be a TT racer.",1
0,138273146,2234020,"Played 3 races, beat some people up, might on wanted by police for vehicular manslaughter.

Would race again",1
0,138272986,2303810,"[h1]Needs a...[/h1]
[i](see publisher)[/i]

[b][u]Game Is:[/u][/b] H classic RPG with a focus on event hunting.

[hr][/hr]
[+]   The art is quite good and the tags are enjoyable, there really isn't anything too amazing but it's a nice time.

[+]   The game has a surprisingly smooth play experience. Snappy char-movement, responsive menu-navigation, H events within buildings are clearly signposted, and it even notifies you if a fight has a defeat scene. Welcome quality of life features for a title in this genre.

[+]   The H stat system and the associated event requirements isn't particularly deep but it's a nice little progression system.

[-]   The entire combat and RPG part of this game is just obligatory default RPG-Maker stuff.

[hr][/hr]
[b][u]Summary:[/u][/b] An enjoyable H RPG, nothing you haven't seen before but a pleasant ride all the same.

[b][u]Tip:[/u][/b] Press F4 to toggle fullscreen.",1
0,138271313,2395410,Fun game but pretty janky,1
0,138271712,2402990,Not bad for the 77 cents...,1
0,138274251,2246110,Sanity. What is it?,1
0,138272522,1155330,"Unique setting, fun exploration, solid tactical gameplay. 18+ hours of fun on Hard difficulty but I'm not sure if there's any replayability. Hopefully some DLC will address that. But definitely a fun game throughout.",1
0,138273901,1669000,"I played age of wonders 3 quite a bit and I have to say in my opinion 4 does so many things better. The race customization is awesome, the lower tier units have a place more in the mid-late game within reason, the magic system is really diverse with a lot of different options in the tome system. I love it. They could still use a bit of work with the combat ai (not hard to get the enemy to bunch up and take a beating from aoe) and diplomacy options. It's still a super solid release overall imo. I've been having a lot of fun with that one more turn addiction.",1
0,138273875,1669000,Fix your fucking multiplayer.,0
0,138273496,1669000,its good,1
0,138272854,1669000,"to me, this game is combination of civilization 5 and heroes might and magic 4 + few new features which I like so far.

fights are not balanced tho, there should be initiative roll and each side should play simultaneously depending on characters speed/strength/tier.",1
0,138274321,1566200,"I love rogue likes, I love sports(especially hockey) This game is fun, humorous and challenging. Can't wait for more content to be released as early access progresses!",1
0,138273981,1566200,Hockey on PC. arcade style hockey. its great.,1
0,138273213,1494420,"I mostly recommend. 

All kinds of EA nonsense that is mostly overlooked for an otherwise VERY fun game and very pretty.

Two current glaring issues.

1. Harvesters: They will lose you the game.

2. Switching Teams mid-game: This allows for Team Switch Team Kill. Doesn't happen often, but when it does it'll really piss you off. Especially because there are no names yet, so they can do it completely anonymously. They can literally join your team without you knowing, take one of your heavy vehicles, and bomb your headquarters. Or just spawn camp and gun down all of your players so they can't do anything. Extremely annoying. MUST CHANGE.",1
0,138272879,1494420,"The game has so much potential.  In it's current state, it is not worth $20.  The enjoyment of the game right now comes from how awesome it feels to be immersed in a giant battle, especially at night.  However, with a little bit of balance tuning, reworking the maps to be less empty, and adding more than the barebones for building options.  I am excited to see where this game goes in it's development.",1
0,138273330,2337630,"game is horrendous. marks dont get paid, super difficult and frustrating. nowhere near worth $100",0
0,138274275,2272970,"For only $5, what this game brings to the table is incredible. 

What the game does well, it does very well. The spritework is amazing, down to the subtle little details, like Gera squinting when their bright torch is illuminated right in their face, or their face showing shock at the sheer recoil of the shotgun when it fires. 

While the game is very punishing, and you can expect to die time and time again, never did I feel 'cheated,' be it by the physics or the enemies. Checkpoints are spaced out juuuuust enough for it to not feel like a walk in the park, but also it doesn't also deflate you when you die right before hitting one, as you are sent no more than 3 minutes back as a consequence.
 
The sound design works well to contribute a different feel to all three areas, especially considering there is only so much visual variation you can achieve with black and white.

The small IV drips of lore in the form of the notes really provide an emphasis to go out and explore. While not a super 'deep' story by any means, I really wanted to find out more about the fate of the other fellows that got trapped in this hole.

Some of the game's horror elements are also really well done. The exploding insect egg things made me jump in my seat a bit the first couple times they went off. The tension in area 2, as you swim closer to the big fish's lair is also very palpable, and it made me really dread descending deeper into the water.

HOWEVER, this game does have some very apparent shortcomings at the moment. Bear in mind that I have not gone for a true ending run, and I have been informed that the feel of the second and third areas are altered under these circumstances. My criticisms are based on my two very casual runthroughs of the game.

Firstly, it is VERY cryptic. I had to scour other reviews and patch notes in order to scrounge enough information to figure out what I had to do. 

Even then, getting a satisfactory ending in any short amount of time is impossible, as the true ending requires you to beat the game without dying. Considering I died no less than 50 times during a normal playthrough, seeing how it's really supposed to pan out seems like a pipe dream. 

There is also an extreme lack of any visually-distinct landmarks, which requires you to memorize the path to the next area in its entirety, which adds a lot of needlessly getting lost into the mix. 

The gun is also a hassle to fire, requiring a 3-button combo to get a shot off. This means it is almost impossible to fire on a whim, causing you to stand there, gun readied, waiting for any creature to find you. If you try to find them, by the time they pop into your tiny field of view, it is too late to take out, shoulder, and fire your gun.

The audio, while good in some respects, still sounds incredibly stock in others. Some sounds, like the really crunchy torch, serve to break my immersion every so often. I also know that a big motif of this game is insanity, but the use of the Shepard tone in one of the areas drove me insane for all the wrong reasons. I will fully admit that's a nitpick, though.

Finally, it's a bit unfortunate that many of the game's horror elements only really have a first-time impact. I understand that desensitization is a thing. After 1000 jumpscares, FNAF isn't really poop-your-pants scary. Nevertheless, I found myself becoming very at ease in these different environs as soon as my first death in them. There is very little in the way of tension build up through audio, and the only thing that works to keep you hesitant is the very low range of visibility. There is also generally only one enemy type per zone, which means you know exactly how they're going to behave as early as your second encounter. Given that a foundational principle of horror is uncertainty, this does not do much to keep the player on edge.

While it looks like I had more mean things to say than kind ones, I cannot stress enough how much fun I had playing this game. It's short, sweet, and infinitely replayable. Please spend $5 to support this developer. It is well worth it!

",1
0,138274477,1742020,a,1
0,138274356,1742020,Better then Tekken,1
0,138274215,1742020,"0 Guras out of a potential 1. Ayame is the best available substitute but definitely not a shark. 

9/10.only because surely Gura will be character 1 post release so I'm giving them the benefit of the doubt :)",1
0,138274114,1742020,It's a fighting game with v-tubers!,1
0,138273697,1742020,"very fun very addicting 
",1
0,138273531,1742020,Waiting for A-chan to be (fully) playable,1
0,138274334,2400880,First of all.  Before playing the game.  Do not touch the resolution.  It will make it so the entire screen is messed up.  My friend has a wide monitor and he cannot see any of the menu options.  If you change it to change it back you have to randomly click on the screen to find the invisible menu options to change it back.  I understand this game is early access but I have never seen a menu so poorly optimized that you cant start the game.  As im writing this he fixed it but had to change his monitor to fix it.  Update.  The game is garbage.  Movement is janky and we were laughing at the game so much that we missed a few of the jump scares.,0
0,138275039,1940340,,1
0,138274888,1940340,worse than DD1,0
0,138274422,1940340,Badly designed,0
0,138274057,1940340,2 Thumbs Up,1
0,138274011,1940340,Extremely grindy and linear. If you loose - you essentially restart the game but get candles to throw into fairly basic upgrades.,0
0,138273929,1940340,"Cool 3D models and enviroment, progress system (candles etc.) bad idea, combat straight up bad and ""cheap"" and healing... I hate the healing system (so bad), End of Act bosses... I expected much more both the model itself and it's mechanics.
I bought DD1 like a month ago and still a fan of it. This game is not a huge downfall but had so much potential which were replaced with either cheap or simply bad ideas.
Btw Flagellant weak, buff pls :3",0
0,138273820,1940340,"It's Darkest Dungeon, what more needs to be said.
Alright, if you want more, then expect all your characters to die a dog's death, nothing goes right, and I'm pretty sure the shambler is looking for you to do cosmic X-rated stuff...

It's fun!",1
