,review_id,app_id,review_text,label
0,138255165,1159690,"A Raft style survival where you basically bring your base along with you. I will be making a lot of comparisons to Raft as that really is the gold standard currently for this style of survival.

Resource gathering is a chore and every single item you only get one of. You have to ""swim"" to each item to collect it for a very long time until you get the hookshot which only really extends like, 10 feet. Compared to Raft where you start with the hook, resources might come within reach of the boat, and there's ""bonus"" barrels containing lots of resources. Voidtrain has ""stops"" along the way with some crates that might drop like 1-3 items, but not a lot. Speaking of which, enemies are at these stops and if you die you lose all inventory items. Why? Where the fuck did it go? I guess the void in voidtrain is a big more accurate for items. Should call this void items.

The items are very annoying to handle, fuel is a constant need and when you only get one log every so often you are just sitting around waiting. There's a lot of crap to carry around too and not a lot of storage. The only chest you get for a while has only four slots. FOUR! Even raft gave you eight for the basic cooler, and then it wasn't long after that you got the bigger chest.

The UI and crafting is terrible, everything you use has a 1 second animation where the UI is brought up and you have to wait. One second you might ask? Who would complain about such a thing? Try out Raft and then want to craft something that requires multiple parts. You'll need to access your storage crates, access your crafting menu, and refuel the furnaces for what you need. It's all seemless, no animations to load it up all fancy, usually requires a simple press of the e to access or refuel. Void Train makes it all more complicated. E to access storage, wait, grab items, exit window. E to access station, wait, choose a fuel, choose an item category, choose a item to craft, click craft, exit out of four windows.

I wish I could say the scenery was good at least. In the distance it's kind of neat, but everything immediately around the train is the same shit, asteroids and wreckage.

I recommend people avoid. It's not as fun as you might think.",0
0,138254715,1159690,"I think that the game's concept is really interesting and they've done a pretty good job of implementing it. I do have some annoyances with some of the game mechanics (like minefields, no difficulty slider, and no developer console <- especially that one), but this is an early access game. If the developers continue to work on it and fix and improve these issues then I think the game would be really fun. I'd still reccomend at least trying the demo to see if it's for you. (Also it works on Linux out-of-the-box on Kubuntu 22.04).",1
0,138253441,1159690,haha train goes choo choo xD,1
0,138255059,1230170,"Not a bad little game.

Personally was not a fan of the woodworking, but it's okay.

Enjoy taking things apart, have not looked to see a complete list of guns available in the main game, but likely that will determine for me if I decide to take the full plunge. Reminds me of car mechanic simulator, and found that I enjoyed that for what it was. 

Not going to to overboard, it's not the greatest game ever, but for someone is a gun enthusiast, which I am, then I suspect there will be something there for you. Mileage will vary.",1
0,138253631,758690,"this the most broken game i have every tried. my profile never shows when i play, when i look in the inventory says character name and shows no model. when i take the helmet off like the game says to do when in doors my character gets locked into place and i can no longer move or open menus of any kind",0
0,138253384,758690,"I recommend this game. Now that being said, its definitely a early Alpha game. You are going to run into bugs. And lots of them. but one great thing is that they have a bug reporting system. plus a discord. voice your opinions and help the devs get this game to a stable state. I has so much potential. Just needs time and effort. which the devs definitely have. be patient with them and the game. As the old saying goes, Rome wasn't built in a day.",1
0,138253166,758690,"It's still early access at the time of this writing and that makes me recommend the game, as I know that it's going to get some improvements along the way. It's a process to learn how to make everything work, things can improve certainly, especially automatization of certain things, but it's good real good potential.

The amount of work it takes to accomplish things is a bit tedious though, you gotta mine and grind for hours to get up to a respectable level of development. I also would like more 'missions' in the story mode rather than just grind. Certain items you need are really hard to find like circuit boards, so I hope there will be a function to make those yourself. Plants are whiterring even though I hooked up a ton of solar panels and batteries, it just doesn't really tell you what you need to do different to make it work properly.

So yes, there's room for improvement, but I am enjoying my time in the game, so I would say to the doubters to go get it, support the team and make it to where they can expand this game into a really good one",1
0,138255042,2001340,"Recommendation is absolutely contingent on your enjoyment of the first game, because this sequel is more of a chapter 2 than something you can just pick up and understand like a zelda or whatever.

But absolutely if you loved the first one, get this.

If you were on the fence with the first one... I actually don't know if the new gameplay is interesting enough to really grab you. But things move a lot faster, some enemies have new gimmicks, dialogue choices matter a bit more, and maybe most importantly, the central gimmick of the series is fixed - the new Soul Cannon will force itself to fire if you don't move fast, which also incentivizes using the Managarm.

Also since they don't have to introduce a bunch of kids this time around way more of the plot is focused on doing plot things with character arcs and so on.",1
0,138254324,1681840,"Very fun!
Great Dev!
Highly recommend.",1
0,138255110,669330,"I almost never review games, but this is a one of a kind game. It's so well done, so enjoyable, and the amount of content for $12 is practically theft. 10/10 from these devs, every bit of this game was done so incredibly well.",1
0,138252905,669330,"fun, quick, strategic!",1
0,138255724,2369390,"is the game good? 
yes
is it worth $60? 
its 2 years old what do you think?",0
0,138255633,2369390,"i really fuck with this game, its nothing world breaking but it fun. 9/10",1
0,138255075,2369390,yews,1
0,138254861,2369390,Amazing. Download the Mod Installer/Libertad Mod and thank me later.,1
0,138254513,2369390,"Its just so good , if you're conflicted about buying it you definitely should, especially if you like the just cause series, it gives off just cause vibes 100% recommend",1
0,138254446,2369390,horrible frame rate second half of the game,0
0,138254207,2369390,"This is still entirely broken on PC, what a joke, after a few minutes the FPS drops to single digits.",0
0,138253888,2369390,nice,1
0,138253381,2369390,"Far cry is a dumb game. Which is a good thing.

I can just get into this game and be dumb and do dumb shit all day.  I love it.",1
0,138254427,1924170,"system i9-13900k, 32GB DDR5, RTX3080TI, M2 SSD

[h1]Not perfect but the best you can get[/h1]
The Isle of Man Tourist Trophy is about the craziest race there is. The game does a great job giving you that experience as player.

Performance is sadly not as perfect as I wish. The engine is outdated, doesn't support DLSS or FSR and despite delivering 90-130 FPS there's always a slight stutter at some point. Not game-breaking bad, but still noticable.

Still they make the best they can with it. The landscape is very varied and the studio did a great job making it not feel like a complete copy & paste job. 

There are plenty of options to lower difficulty to a beginner friendly level. If you're unfamiliar with bike racing a few tips:
[list]
[*]Use beginner physics, they are far more forgiving than realistic ones
[*]Start a career in Supersport, the bikes have less power and topspeed and are slightly more nimble
[*]Play in exterior view. While 1st person is awesome and thrilling, it's the worst to learn the course and bike behavior
[*]Lean into curves early, not when you just reach it
[*]At beginner level you can break later than indicated, maybe 0.5-0.75s when entering the ""red zone""
[*]Change controller sensitivity: custom control layout, sensitivity 5 (default -5) and deadzone 1 (default 10)
[*]Play it safe till you know the course, not crashing saves you far more time, than taking a curve on the very edge of performance
[*]If you leave track (curbsides, gravel, sand, grass), don't break and don't accelerate. Carefully try to get back to track, that's your best bet not to crash.
[/list]

[h1]Positives:[/h1]
[list]
[*]Varied landscape and courses
[*]great physics
[*]incredible speed sensation (especially in 1st person view)
[*]great variation of drivers and bikes
[*]great difficulty options
[*]high long time value 
[*]Time restricted challenges apart from online championship: measure your skill with others outside of a race by beating their times
[/list]

[h1]Negatives[/h1]
[*]No DLSS/FSR support, no stable FPS. Not as smooth as I expect of a racing game (e.g. Forza Horizons or Grid). Even at low settings I get occasional micro stutter
[*]Upgrade system is kinda stupid: you upgrade parts, and your opponents do so along. In the end, it just increases general performance and difficulty for you ;)
[*]Carreer qualify/race system is stupid: you do a qualify time one part of a track, only to do a race one a different one afterwards. Where's the point in that?

[h1]Final thoughts[/h1]
Ride, Rims, TT Isle of Man... Why the few superbike games on the market can't deliver a smooth racing experience? The last  one I personally recall is the ancient Superbike World Championship by EA (1999). TT Isle of Man: Ride on the Edge 3 still is a great gaming experience and racing those high power machines through towns and country roads is awesome fun. The learning curve for beginners might be high, but there's enough of options to give you a fighting chance.",1
0,138253148,1924170,"TT3 Takes the great simulation from Rims Racing and combines it with an immersive open world set on the Isle of Man itself. Having the open world on the Isle of Man is absolutely awesome, and is much preferred to previous games open world on made up roads in Ireland. I want to point out that contrary to what T_balls implies in his review, the open world feature is not a time waster. Races and challenges are in different locations on the map, but you are not required to ride to the location to start a race. You can simply open the map and start the race from there. The simulation is much improved from the last game to be more realistic and challenging, well also being more predictable. In the previous game you might fly off your bike instantly while going straight over a small bump. TT2 also gave your tires infinite grip and would not allow you to lean too far. Though that might make the game easier if you want a more realistic simulation of a motorcycle than TT3 is the right game for you. However if you want to just chill out and go fast around a beautiful course, then you can simply turn down the simulation and it becomes much more difficult to lose control of the bike. 

A few people have been whining about not being able to flip the bike side to side in a split second. Besides the fact that they are exaggerating how much slower the transition is compared to other games, there are settings that you can change to make it more sensitive. You can also improve the way you enter a corner by trail braking more, as a bike will turn in better when the front is loaded. If you going though a fast corner that doesn't require braking you can let off slightly as you initial the lean. 

The upgrading process is much more convenient and easy to use than the previous game. All you need to do is get upgrade points from racing, then spend them on upgrades. There is no requirement to complete other things to unlock access to high level upgrades before you can buy them.  

There are a couple bugs I have found as per our usual arrangement with new games I guess. One bug involves not being able to shift gears when you start a race or challenge. This seems to only happen occasionally, and when it does you can fix it by exiting the race, shifting gear in the open world (you are always in the open world if not in a race or challenge), then restart the race. You do not need to restart the game. I have also experienced an audio bug where after riding around for about 30 minutes sometimes the engine sound at low RPM will be distorted and shifting sounds slower. However no one else seems to have had that issue. 

Overall I recommend this game to any racing fan, and especially any motorcycle racing fan. The game is quite immersive and can also be a great teacher of all things TT related.",1
0,138255668,855740,pissed on a cop and then panhandled more money in an hour than I make in a year in real life. cant wait for the crackpipe dlc,1
0,138255667,855740,"Less than an hour in and I've already laughed a bunch and have gotten over $9 of entertainment. Great game, unexpectedly refreshing.",1
0,138253823,855740,"draw peter griffin
get money.

didn't get money with Peter griffin?
get to pissin.",1
0,138255490,2279710,"Super fun and challenging game, plus we learned a little bit about programming logic.

Very good",1
0,138253466,1559600,"So much fun and so cute! The perfect game not only for people who like horses, but anyone who likes cozy games. Serotonin Simular.",1
0,138253794,1888860,"A very fun game to play with friends after you find how it works. Make sure to read tutorial and look on the map, before you start the game though because some things are a lot of confusing. 
I do believe the developers are working hard to address known issues, and I will give it another try in a few months after an update or two.
6/10

BTW watch out for the damn mines!!!!!",1
0,138255798,2401420,JOHNNY THA GOAT,1
0,138254582,2341030,"A noticeable improvement over the last game called Grim Quest of which I played for about 50 hours on my phone. The combat is simple, but deep enough with skill trees, including various moves for various weapon types and magic skills. Levelling is satisfying, with a wide variety of perks. Buying ship perks ( restoring morality, health, revealing enemies on tiles etc.) is very useful and serves to improve survivability in the dungeons. Great music, with some new songs in the PC version if i am not wrong. The absolute best though is the writing. Great use of english with appropriate language. I looked forward to reading the journals and tablets of the Mua Ta ( with great sketches and permanent bonuses for each). After you are done with the main story, there is a decent bit of content. One of the best games, especially considering that this is an indie game. Would love to see what the dev could do with a bigger budget. Sretno!",1
0,138255834,1277920,"was not meant to be release yet... buildings dont even spawn in and their servers are saying ""low population"". Its simply not ready needed much longer bake or to come out as early access and proceed to full release after a couple years",0
0,138255292,1277920,"This game failed launch day, so I waited until the relaunch to play. 
This review will focus on the game itself and ignore all the bugs still present after the relaunch. Spoiler the game itself is bad. 
This game proclaims itself as an ""old school MMO"", which means they intentionally make bad game design decisions and won't apologize for it. 
Because it advertises like this the community is filled with people making fun of you for asking for help because you can't figure it out on your own. 
THERE IS LITERALLY NO FRIENDSLIST!! WHAT'S THE POINT OF AN MMO WITH NO FRIENDSLIST? 
LITERALLY NO WAY TO FIND SOMEONE AGAIN BECAUSE WHISPERING REQUIRES YOU TO RIGHT CLICK
THEIR IN GAME MODEL. It may as well be singleplayer because there's no way to make connections with people.
The game does a terrible job explaining things, mostly via text dumps. 
The woodcutter explains how to cut wood, but won't explain what to do with it after.
You can't even access the herbology tutor because they are behind locked doors and the guards don't explain how you can meet them, the guards only say location which is useless if the door is locked. 
Tutorial shows you how to gather, how to cook, how to repair. It does not explain combat. 
Tutorial does not cover crafting at all. 
You need to type to npc's and find the correct words to prompt them for information.  It's like they wanted to be cool and have AI NPC's, except none of the NPC's are AI and it's just a visual novel with preprogrammed inputs that you don't know. You can't even do prompts which make sense in context of the quest. If I return to the baker and say ""I have brought the rabbit and mushrooms"" the npc literally does nothing. There is no point in this convoluted system of talking to npc's that they made. 
If you hover over hemp it says it needs to be processed at the fiber station. When you
go to the fiber station you can deposit them hemp into it yet nothing happens
because you haven't talked to the herbologist located behind a locked door. 
No diagonal movement - this is intentional and will not be added.
AOE spells and getting attacked does not cause you to start autoattacking. 
Only auto targeted spells start auto attacking.
Parts of terrain are not visible unless you rotate the camera, this starts affecting
gameplay even during the tutorial. They also never explain you can rotate the camera. 
Many NPC's will not repeat quest dialog, so if you didn't memorize everything the first time
around then you can not prompt it for locational clues. 
For gathering resources that need tools, you need to right click, click a context option and then click to select the tool you want to use to harvest the resource. This is way too slow and clunky. Harvesting should just be a one click, not 3 clicks. 
There is no timer on combat, so you don't know when you are about to leave combat so that you can rest. 
You just need to wait for the icon to disappear, which again they don't even explain that there are status icons. 
If you hover or select a spell it does not have any range indicators. 
If you are standing next to some terrains some spells just can't be cast. Not a bug. 
Minimap does not show ladders. So you can be stuck in a cave and not know where to go, oldschool MMO garbage design.
Minimap is pixelated but not 1:1, so it shows gaps in walls that aren't actually there.
Minimap does not show points of interest, like banks or vendors. 
Mobs do not have a leash range. Mobs can attack while moving but you cannot attack while moving. 
You can see items on the ground that other players drop, but you literally cannot interact with it. 
There are no keybinds for quick storage, which literally every game has. You have to manually drag
and drop items into storage. 
If multiple things are visually stacked on top of each other you can only select the entity in front. 
I found lots of seeds while gathering, don't know where I can plant them.
Multiple quests are unfinishable if you don't ask for help because of the old school ""figure it out"" mentality of the developers. But if you literally walk tile by tile through the main town the junk quest cannot be completed because the 4th one doesn't exist. 

Keep in mind these issues are not bugs, they are intentional. The interface is garbage, the playability is garbage, you can't make friends, and nothing is explained to you. Even when they eventually fix all the gamebreaking bugs that currently plague the game it will still be bad. Would not recommend.",0
0,138255232,1294810,Average gameplay that other franchises already perfected. However the art and immersion is awesome. I had a good time.,1
0,138256958,1669000,Fun,1
0,138256632,1669000,"Only have an hour of game time writing this. Runs perfectly using Linux tried on Arch with all the newest updates, and fedora 38 with proton 8. No issues at all.",1
0,138255291,1669000,Been a long time since I felt such joy playing a game!,1
0,138256410,2266160,"For God so loved the world, that he gave his only Son, that whoever believes in him should not perish but have eternal life.

John 3:16",1
0,138257358,1494420,action packed,1
0,138255230,1494420,"This game is well worth the bugs and the developer is very receptive to bug reports on the Discord server. 

This is the best community I have ever seen. It is amazing to interact with other players from drastically different gaming backgrounds and work together. I was even able to join a community which holds tournament and are very supportive as I slowly master the game.

The best part is the battles are so epic and explosive, that it is still fun while loosing.",1
0,138256913,2002220,"It's a bit early in, but the game has a lot of promise. for the price it's pretty fun, and I'm going to see how far the devs take it.",1
0,138257226,1824960,"Check out this decent game with some good jumpscares!
https://youtu.be/Tc86IVbF8jc",1
0,138255086,2316340,"A story with intriguing potential.  That's how you could describe the demo. I like isekai. So the game interests me. 
The prologue makes it clear that something bad has happened. You can guess what it is, but it's still interesting to find out how it really happened. 

The heroines are beautiful and sexy as hell! Especially Kotonoha. If you read about halfway through the demo, you'll know what I mean. 
Their characters are vastly different. It's like they're opposites of each other. 

So I'm looking forward to the novel's release. I really want to see what happens next.",1
0,138257684,2262610,Burger,1
0,138257134,2262610,"FUCK MR KOALA

ALL MY HOMIES HATE MR KOALA",1
0,138255469,2325900,"Not usually a fan of strategy games but this was pretty fun. However, after round 13+ the world became very laggy. I reset the game and it starts crispy smooth until a few more rounds then the lag comes back. I only played on ascension 0 & 1. It was very easy after you understand the mechanics of the game. I was getting 100% happiness every round because I stacked forest reserves on top of each other, fishing posts with boats gave me 30+ food each, etc. As long as you can find the cards you need during harvest, the game is almost too easy. Maybe I just need to try harder ascensions but I would at least like more fighting. I killed the boss without any physical units just metors & lightning.",1
0,138257963,2311190,its ok,1
0,138257686,2311190,When i play the game it is really dark and super hard to beat but when i watch youtubers play the game it is bright for them and i tried turning up the brightness to the max and it did not seem to do anything.,1
0,138255378,2311190,The Euphoric Brothers have outdone themselves this game is amazing I cant wait for chapter 4,1
0,138255054,2311190,"Quality is going down hill. I would expect the game to improve with each iteration but part 3 definitely feels like a cash grab. I played this with my son and he was super hyped about the new characters but this game is underwhelming. The checkpoints are messed up, sometimes you end up repeating a section again and again and it just takes too long because of the checkpoint. The difficulty seems messed up too, often requiring very precise movements to the point of exasperation. I was a big fan of part 1 and 2 but by now if feels like the brothers are playing all of us for fools. This game felt like half of what it should have been.",0
0,138257931,1742020,Yubi Yubi go brrrrrrrrrrrrrrrrrr,1
0,138255511,1742020,Fantastic free fighting game with Hololive!,1
0,138257569,1940340,good,1
0,138257030,1940340,Who ever designed Act 3 I hope you stub your toe,0
0,138257003,1940340,"An imperfect, streamlined reimagining of Darkest Dungeon. Darkest Dungeon II lightens the ruthlessness and despair of wasting hours training a team only to face their imminent massacre, while retaining the signature tone, difficulty, and strategic mechanics that made the original special.

While masochistic fans of DDI may scoff at this sequel with its shift in direction and accompanying quirks, I'm having a genuinely enjoyable time and would happily recommend it to fans of the genre.",1
0,138256833,1940340,"I can't stop playing please help!

Also if you want to feel attached to your characters like in OG DD1, only allow characters to progress to later acts that have memories, meaning the same lot have to make it through the entire game.",1
