,review_id,app_id,review_text,label
0,138316072,2369390,"Just Wow... and not in a good way. From a major game studio... this is perhaps the biggest embarrassment and piece of garbage I have ever experience. The game is not playable, not optimized, all searches to improve framerate have failed. Turned off the overlay, optimized the setting (turned them off or down) etc. I have 32 gb of RAM and a top of the line computer with Nvideo geforce RTX, etc. There is a reason that the game is on sale for 75% just 3 days after launch on Steam. Just wow...",0
0,138316005,2369390,"Short and sweet review:

The Good: 
- Basically take Far Cry's mechanics and mix them with Just Cause's story and a scaled-back version of destruction/chaos. It's not a game mechanic, but it's definitely got that vibe to it. 
- Tight, responsive gunplay.
- Animal companions are fun and useful - you don't feel like you're babysitting them. 
- Characters are well-written. 
- Voice acting is nicely done.
- It's pretty. 

The Bad:
- They've gotten rid of skill trees/player progression in favor of equipping clothing with certain perks. 
- Looting animals and hunting for items to upgrade your weapons and gear is pared down nearly to non-existence in the form of a workbench.
- Ubisoft's required launcher is an unnecessary dumpster fire.
- Get ready for a long wait when you load it up the first time while it pre-cooks every asset known to man. 
- You can't aim the fecking Supremo. 
- Enemy AI is basically swarm you until you drop out of sight, at which point more than half of them walk backwards towards your general area so you can stealth kill them. 

TL;DR: 
It's fun if you get it on sale, but I keep thinking about how I'd rather just go back and play Far Cry 4, which I enjoyed far more in pretty much every way except the updated visuals. Not a bad game, but wait until you can cop it on sale.",1
0,138315951,2369390,"Far Cry 6 is a blast to play with its fantastic weapon customization system and beautiful open-world setting. It's great to finally have this on Steam. The game encourages creativity in combat with a variety of weapons and gadgets to experiment with. The story and characters are engaging, tackling themes of revolution and oppression with nuance and depth. Overall, if you're a fan of first-person shooters and open-world games, or just want to have some fun blowing stuff up.  Shame there's no achievements tho",1
0,138315871,2369390,"No achievements and 30 fps locked cut scenes. FOV is garbage when in vehicles and horses. I bought on sale for $15 and I feel slighly ripped off. I feel like the series is regressing, FarCry 4 was the last ""good"" game. Ubisoft launcher is awful, maybe scrap the launcher and spend more money developing a decent game you turd brains!",0
0,138315864,2369390,Good,1
0,138317109,855740,This game had a profound impact on my life. So much so that the only reason I stopped playing it was to become homeless myself.,1
0,138316532,855740,"i find this game to be hysterically funny. the main menu music is the best. and the shopping cart deserves an academy award or something. an emmy. 

all in all, i always wanted to be a bum, and this game lets me live my dream. ",1
0,138316292,855740,"After long (5h) playing, i can say that its a unique masterpiece which is often misunderstood.
Yes of course it has its weaknesses and flaws, but that makes it unique.
I had a lot of fun on experiencing the game, and say that its worth a try.",1
0,138315974,1559600,Awesome game! A must for anyone who misses the horse games we played as kids! :D,1
0,138316521,1294810,Fun relax game feels kinda like borderlands.. All in all doesn't deserve all the harsh negative reviews it was getting...,1
0,138317811,1155330,"Its a good bite sized xcom snack. I enjoyed it, i think i got my money's worth but it has no replay value.

The mechanics are mostly well implemented, but i think it goes overboard with cooldowns, 5 turn cooldowns in a game with missions that can last as little as 1-3 turns. Enemies are good except that sniper one, it just randomly one shots your guys even behind high cover if you dont deal with them immediately, feels great.

The teammates kind of suck, half of them are introduced as the game is ending and why would you not use, the main character that is obviously the most op, the sniper you definitely need to deal with the one shooting sniper enemies before they get to shoot and the npc with the mimic beacon that can disable enemies and get them to shoot something else while you get in range ? You can only use 3 for most of the game, and those are the 3 you are going to use, the others are kind of redundant. I would have preffered for arenas to get bigger and let you use all the characters in every mission after they join.

The game runs pretty well with the exception of some animation and camera bugs and one horrendous bug  that ruins one of the end game cutscenes that i cant believe they havent fixed yet, even the youtube videos i checked had to skip that cutscene because of the bug.",1
0,138317937,1669000,"I can't believe I'm writing a bad review about this game, but here I go.

I have been playing the last mission, Grexolis, for two straight days. It's freaking absurd. The randomness in the game is good in general, until you play the last mission. You have unbreakable allies who do nothing apart of blocking your cities so you can't expand properly, stealing from you the little resources you can have. 

Did I talk about the enemy? An awesome AI which starts with maxed capital cities and resources (or cheats) to deploy an entire army for each single unit you're able to recruit. This happens in general in every map, but in this one is specially tedious because between the map settings and enemy buffs, even their support units can oneshot your units in one turn with ease. 

The first time I played this, a vassal city with his race and bufs spawned just in front of my city, and deployed 3 armies full of T3 units able to oneshot my T1. Oh, I was barely able to deploy 1 T1 army. The only reason you can win is because the AI is specially stupid and will not play as agressive as it should. Otherwise you would be razed by turn 10. Knowing this, you can attempt to cheese it until one of the 4 enemies decide to deploy magic victory by turn 60. Did I mention you have only 15 turns to stop them, while in that stupidly designed map you need like 30/50 turns to go from one corner to the other? If you're lucky enough to be near of that enemy when he decides to deploy magic victory, you can send your 3 T3-T4 units in time, and you will find yourself surrounded by 9 T5 armies with units oneshotting not only your units, but your very heroes.

It's obvious this quest battles and victory conditions haven't been tested properly, and it's frustrating. It's a great game overall, and I would recommend it as soon as this is fixed. Meanwhile, however, I can't recommend anyone to get involved. Right now it's an open beta. There are some bugs (like sieges bonus coming against the player if the defender attacks him). but nothing game breaking apart of this design. You can't give 15 turns to stop an enemy which is 40 turns from you. 

I hope the devs spend more time playing the game next time. This could have been easily avoided. I will have to cheese the map or play it until I am lucky enough to have all the odds in my favour. Knowing myself, I won't stop until I achieve this, and I hate it won't be because of skill or mental agility, but out of luck and cheesing. This is frustrating and has broken my experience.",0
0,138317595,1669000,It is a ton of fun.,1
0,138317487,1669000,Its as if the Civ series and Xcom made love and had a baby. I've had a few crashes admittedly but the devs did a patch already so they seem to be on top of it,1
0,138317211,1669000,"Imma be honest, this game isnt perfect, it can be boring at times, but for a 4x game, it's pretty addicting and (relatively) shorter than most, with still as much content as the rest. Similar to games like total war, you can get quite good at managing armies in the turnbased battles to easily beat outnumbered odds, or use spells to switch the tides of battle. Spells are a BIT overpowered though, but from what I can tell, thats normal for an age of wonders game so...",1
0,138316718,1669000,I like it is very interesting,1
0,138316400,1669000,"The game seems to have a lot of graphic crash issues. Now I cant start the game because of it tells me I might need to install C++ redistributables. When I was able to play, the game crashed every other time. Hopefully they fix soon.",0
0,138317784,2272420,I generally liked the prologue even though there isn't a lot of new things compared to the first game.,1
0,138318058,1566200,"Pls add a poke check where you stick out your stick, when you poke check you basically never get possession of it. Other than that game is 10/10",1
0,138317957,1566200,"good
",1
0,138316592,1566200,"This game is dumb as hell, and simultaneously some of the most fun I've had in a very long time.",1
0,138317870,1494420,This game has HUGE potential. It is definitely not finished but the basic game play it provides right now is incredibly fun. Incredibly pretty and definitely worth a try.,1
0,138317852,1494420,"Its an amazing game, just needs a little more time to add more content.",1
0,138317301,1494420,This game is everything i wish starcraft would be  and i really really hope this dev get everything he needs to makes this game even more amazing harvesters are stupid though but i think if they were to smart nobody would want to drive them but i love it,1
0,138318159,2262610,"A honest simulator of an office life with the people involved inside it to keep things up and running. Wait, did I really just play a game about work life outside of work? Geez.

9/10",1
0,138318302,2311190,never make a video game ever again,0
0,138318288,1742020,Terrible fighting game. Don't let your Vtuber addiction blind you to that fact. Feels like a student project made at the last minute.,0
0,138318118,1742020,"Really good and really fun, unfortunately the game doesn't run smoothly here, because of my weak pc, still i have a lot of fun everytime i play it :D",1
0,138317989,1742020,"This game is so wonderful, i am dye, thank you forever",1
0,138317916,1742020,king of fighters for people that dont wash their ass,1
0,138316856,1742020,"i get to beat up my friends as an internet fox and get beaten up by an oni girl
10/10 has rollback netcode and plays like skullgirls",1
0,138318621,2159470,more weapons,1
0,138318683,1940340,I like it,1
0,138318630,1940340,"[b] This is a review ON THIS GAME and not a comparison with Darkest Dungeon, take it as it is [/b]
I've played this game for around 50 hours now. I'm a big fan of turn based games and turn based rpgs since I was a kid (no I don't have other turn based games on Steam because Nintendo DS and other platforms are not related to steam so chill about it), and I have to say, this game is entertaining for me and frustrating at the same time. I really love when a turn based game makes its own take on the turn based gameplay, creating or modifying some mechanics, and the main core gameplay of the turn based part of Darkest Dungeon 2 does not do anything particular to change the classic formula, it consists of: Every Round lets a character act once, you have your four characters and the enemy has one to four characters as well. The order is decided depending on the [i] speed [/i] of every character (needless to say, the one with the highest speed go first and so on). The particular take it uses is the [b] rank [/b] system, which is still implemented in some measure in basically every turn based game that makes you use more characters at the same time, the difference is that here it is a little bit more important than it is in [b] most [/b] of the others.

Now, in short, it means that the mechanics around turn based combat are solid and work well, but don't bring [b] too many [/b] new elements on the table, and it still is a pretty slow paced game, even for a turn based game, most of the time. These are all elements that can be good or bad depending on your preferences, and I don't mind them.
The artstyle of this game is [b] incredible [/b] in my opinion. I love how it communicates efficiently the mood of the world in which you play, both on the visual and audio effects, with its music being epic but never over the top, always keeping its gloom and the designs being absolutely on point with every character, both the heroes and the enemies.

The Stagecoach. I actually enjoy the Stagecoach and what brings to the table, both its passive buffs and debuffs, and the mood it brings to the journey, it really feels like a fantasy adventure with a party of heroes traveling towards the enemies and the encounters also add to that beautifully. There are some things about encounters that I don't enjoy sometimes, but I will cover it soon. I like the fact that traps and other things can break your Stagecoach, and force you into an ambush, even if it's a bit frustrating, because it's exactly how it should feel, and usually do not result in a game over in such encounters anyway, it feels like a setback and an inconvenience, exactly what it should be.

What I liked and didn't like about encounters (not fights, encounters on the road): I really liked how the choices you make directly influence your strategies, with resources you can give to people in exchange for other things, or simply to make characters bond when they have a similar opinion on something. What I didn't like it's how sometimes relationships can get out of control and backfire pretty hard, most of the times a single [i] meltdown [/i] can ruin a character's relationships with everyone to the point everyone starts to build a bad relationship with him and he can get different skills debuffed for one single mistake. This is a really challenging game, but sometimes, some things are out of your control and it can quite literally ruin a run for you. Relationships, like in real life, can snowball out of control, either in a good or bad way, sometimes. From what I've seen, if a character hates another, they will likely not take well some things that they would ignore if they were friends, and that will make things worst, to the point they will eventually and quite literally stab each other in the back during fights sometimes. Truth be told, you can learn to manage relationships through items and sometimes trading some party advantages to try and make things right, but yes, it can be quite annoying when you find in a boss fight that quite literally breathes and fills up your party's stress, and a couple meltdowns occur, and now everyone hates those two heroes. Relationships can also snowball in a good way, making friends and being hopeful or trustful towards each other can make heroes even fall in love with each other and create even some combos of sorts, buffing each other in pretty strong ways, which is always great.

Now to the farming part: [b] you can farm stuff in this game, and it's not a bad thing [/b], farming heroes is literally ""instantaneous"" and by that I mean that after my very first run I unlocked almost every hero and started trying them all out. The game itself tells you you are not expected to win on your first run and Darkest Dungeon 2 is a game of struggle and trying and trying again, and it does reward you for completing runs even more than once, making you lock some good quirks for your heroes so that they become ""permanently"" (because these bonuses last until they die in mission) stronger. In short: I don't mind the fact that I need to farm a little to unlock things, it's not boring, nor repetitive in my view, not more than any other turn based game at least.

[h1] So, my opinion about Darkest Dungeon 2 as a stand alone game is: [/h1]
I really enjoy playing it, it is one of my top 5 favourite turn based games, one of my favourite dark fantasy games of all time and I really recommend it, especially for those who are looking for a challenging game, since it's really punishing and even some little mistakes can make a big difference in a run. The designs are [b] incredible [/b] and succeed impeccably in expressing the world around you and its mood, both in visual and sound effects. The game is [b] difficult and pretty demanding for someone's brain [/b], which means it will keep your brain busy if you are trying some more advanced runs or are not being perfect, or you're simply pretty unlucky in that run, it can happen. There's a lot to keep in check, from relationships between characters, each character's stats, their build, items, trinkets, illnesses, buffs and debuffs both in and out of combat, which is a lot but you can get the hang of it after some time. The way it implements relationships between characters, the way it narrates their stories and how it implements the element of having actual characters and not just pawns to move is beautiful, and I wish it was present in more games like this one. Last but not least, you can unlock buffs, heroes, trinkets, items, stagecoach items, inn items and many other things through farming, and it's okay, it's not expensive if you manage to win your expeditions or end them a bit later instead of quitting early. 

I intentionally avoided comparing this game to its predecessor, because it has some changes, mainly in form, but in my opinion, the soul of the game is still the same, and all I am hoping to see from the first game are some characters that didn't make it to this game. People should accept that games change and evolve, and a game should be reviewed for its own qualities and flaws, not for what makes it different from its predecessor, after all, if it didn't change anything, it would've been criticized for being just a reskin.",1
0,138318499,1940340,"This is NOT another Darkest Dungeon, as many other reviews have said. As long as you go into this game with that in mind, you will easily see it as the stellar rogue like that it is.

I would also recommend watching a little bit of game play prior to making up your mind about picking this up. I would expect that several of the negative reviews of the game are from people who found the changed systems too jarring.

I've absolutely devoured the game so far and love it just as much as the first one!",1
0,138318244,1940340,"it's been a lot of fun, RNGeesus can be a bitch tho haha",1
0,138317982,1940340,I fucking hate this fucking game. Everything about it pisses me off. I'm sure it's a good game but I hate it. Fuck this game. Fuck the people who made it. Fuck you. Fuck the fact that getting into a negative relationship swaps your skills around. Fuck enemies getting strings of crits on you. Fuck enemies ignoring your taunting Man at Arms because /shrug. Fuck the goddamn Librarian. Go to hell. Eat a dick. I resent this game and everything it stands for.,1
0,138317934,1940340,"Preface that I have played the first Darkest Dungeon and quite enjoyed it.

This game shifts from the city building and roster management aspects of the first game as mentioned in other reviews. However, if you give the game a proper go instead of just shidding and pissing because the devs made changes you'll actually find a really enjoyable experience that's more geared towards longer term replayability than the first game IMO. While you don't get to keep your characters and gear in the same sense as the first game, you can carry them on in a basic form with upgrades each time they beat the final bosses. Additionally, each run (whether successful or not) is able to contribute to the development and betterment of your future characters and runs. Sound design is en pointe as always (I will wake up screaming at 3am with the stress damage sound looping in my head) and the game looks stunning. One of the other reviews I read gave me a piece of advice which I will pass on. Focus on character relationships. They're a very crucial aspect of the game that is easy to overlook and once you understand that time and care is needed at each inn to focus on relationships you will start to get much more rewarding runs with great team synergy.

As is the case with the first game the experience is mostly an experience in self torture and Murphy's law. But I'm addicted and can't wait to get back into it.",1
0,138317884,1940340,"First of all this game is a very different beast than Darkest Dungeon. It takes away a ton of what made Darkest Dungeon so good. Just be aware of that!

The presentation has gotten the most noticeable upgrade. The art style, animation, and music and voice acting is good.  Combat also functions decently well still, but there's very little new in terms of classes or skills. There's less management and freedom in choosing missions, gear, and difficulty. This makes the game less enjoyable for me. In Darkest Dungeon you could after a failed expedition try to build yourself up a new team doing easier expeditions. But there's less grace for that here.

One of the worst aspects is having a poor run where you actually hurt your subsequent runs. In theory, you get a resource which you spend to make yourself stronger. As you unlock items you get to use them for free in your next run. But if you have a bud run then, and don't manage to gather enough stuff, your next run will be without any free goodies. This can lead to a very hard cycle of having bad runs  with little progress. It can make the early game grindy and frustrating. 

But it also tickles your desire to return to the enemies with improved strategies and tactics. There's few things as satisfying as beating a boss you've tried to beat 10 times before. (Maybe I'm just that bad at the game tho)

I barely recommend this game, and I would try to get it during a sale.",1
0,138317765,1940340,"Aame same but different. If you liked the first one, you'll probably like this one (depending on your degree of buttthurtiness).",1
0,138317336,1940340,Fusion of Darkest Dungeon and Inscryption. Very rogue like. It's got a good game play loop. Recommended.,1
0,138318588,1547670,"I think this game is really good, I hunted cryptids for about 50 mins and then lost, but then I found a wall in the spawn forest with a pentagram on it, with no observable way up. From then on I spent 4 hours spamming on and off of the god awful broken Quad physics and made it over that wall and many others. Highly reccomended",1
0,138318564,1547670,lmk if you manage to find the crushed miner,1
0,138317499,1159690,Great game,1
0,138317335,1159690,raft and volcanoids had a baby in space 10/10 been waiting years for this,1
0,138317292,1159690,"I'm about 22 hours in and I'm kinda bored with the mechanics of the game, 80% of the game so far is floating around grappling items in. 20% is visiting depots, which so far are all the same.
Cons:
Small stacks and even smaller storage boxes.
Upgrading to a tier 2 workbench and having to keep the tier 1 cause 2 won't make the previous items as well.
Not much of a variety in resources, just sub-component after sub-component to try and add complexity rather than just giving new resources to play with.
After 22 hours I still don't have walls or a roof or any decorations for that matter, just open platforms loaded with unnecessary workbenches
Not much in terms of automation for resource collecting so far so plan to spend most of the game floating around collecting items.

Pros:
It's a weird concept, somewhat original
Story seems ok so far? Eh maybe.",0
0,138317104,1159690,rly nice game,1
0,138318370,2334780,Adopten perritos y compren Canine.,1
0,138318802,758690,This game finally brings to the table what it would take to actually colonize Mars. Very detailed game and very realistic. When multiplayer is added can wait to play with friends.,1
0,138318279,758690,"ive enjoyed this game very much, yes it as some bugs but for a alpha release it is very good",1
0,138317150,758690,It's awesome.,1
0,138318090,669330,It's too late I'm addicted to it now :(,1
0,138318084,669330,"Nice autobattler with supreme commander optics. Great,tactical gameplay,really friendly community!",1
0,138317356,669330,A very nice auto battle game with a lot of depth and attention to detail,1
0,138317118,669330,"A fantastic, deeply addictive mecha auto-battler. Way more than the sum of its parts. Deep strategy and much satisfying kablooeyness. Still in Early Release, but very playable and worth the price.",1
0,138318645,2369390,good game,1
0,138318557,2369390,goodgoood,1
0,138318317,2369390,,1
0,138318182,2369390,You can pet the dogs 5/5,1
0,138318115,2369390,"I can see why the game were removed from steam. The simplest of things and the game crashes. Twice I have attempted to take a screenshot and the game just melts and crashes. That's pretty bad. The game has some beautiful cinematics and scenery.Just can't help but wanna take a shot of it, too bad. Poorly optimized enough to not be able. Just gotta remember to not take any screenshots

PC Specs:
8700k
3070
32GB Ram",0
0,138318046,2369390,"So much better than I had anticipated. Got it on sale for $15 and had I known beforehand how fun and beautiful it is, I would have bought it sooner even if not on sale!

And the Mods... Wow... make it even more fun! I don't miss that $15 one bit!",1
0,138317416,2369390,Its amazing for what it is and it displays the world and horrors of the war very well but I will say that if instead of making enemy's have more hp they should've made them be more geared like the hp stays the same but there's a armour bar that goes down the more you shoot and their guns get bigger and badder but another thing is how you can one shot chiefs if you head shot them with a sniper rifle I mean it makes sense but the ones in military camps should be stronger but over all its a great game would recommend,1
